href,title,date,introhttp://www.livemint.com/Money/A5zgbPsz1o1gNj5Cv1QoyL/HDFC-Bank-defies-a-challenging-environment.html,HDFC Bank defies a challenging environment,"Sat, Apr 22 2017. 12 18 AM","HDFC Bank reported a net profit of Rs3,990.1 crore for March quarter, an 18.3% increase from the previous year, against a tepid 15% rise in the December quarter"
http://www.livemint.com/Companies/utY4oU6ZBD2v0jSzeeS0LL/ACC-profit-falls-89-but-sales-beat-estimates.html,ACC profit falls 8.9% but sales beat estimates ,"Fri, Apr 21 2017. 09 57 PM","ACC’s net profit for the quarter fell to Rs211.06 crore from Rs231.70 crore a year earlier while its sales in the quarter rose 9.1% to Rs3,556.70 crore from Rs3,259.95 crore a year earlier"
http://www.livemint.com/Companies/OeQN4QZK0cvMqa4N8bis8N/HDFC-Bank-Q4-profit-rises-18-to-Rs3990-crore-bad-loans-st.html,"HDFC Bank profit rises 18.25% in Q4, beats estimates","Fri, Apr 21 2017. 01 42 PM","HDFC Bank’s net profit rose to Rs3,990.09 crore in the fourth quarter from Rs3,374.22 crore reported a year ago"
http://www.livemint.com/Companies/OigiVBKZEGQOglsVs9VMLO/Crisil-Q4-profit-stays-flat-at-Rs-73-crore.html,Crisil Q4 profit stays flat at Rs 73 crore,"Fri, Apr 21 2017. 05 09 PM",Rating agency Crisil has reported a muted net profit in March quarter at Rs 73.34 crore  while its March 2016 net profit stood at Rs73.15 crore
http://www.livemint.com/Companies/MHX8R7YsCi0Mvcr4wz5thO/ICICI-Lombard-net-profit-grows-38-to-Rs-702-crore-last-fisc.html,ICICI Lombard net profit grows 38% to Rs 702 crore in fiscal 2017,"Fri, Apr 21 2017. 04 25 PM",ICICI Lombard’s net profit in the 2015-16 fiscal stood at Rs507.5 crore
http://www.livemint.com/Companies/4fOhYqv6yyHetUgWJboGzK/Hindustan-Zinc-Q4-profit-jumps-42-to-Rs-3057-crore.html,"Hindustan Zinc Q4 profit jumps 42% to Rs 3,057 crore  ","Thu, Apr 20 2017. 04 54 PM","Hindustan Zinc’s fourth quarter net profit rose to Rs3,057 crore from Rs2,147 crore a year earlier"
http://www.livemint.com/Companies/qqNIsJmx7RPVIa4wRG82yM/Mindtree-Q4-profit-plunges-27-misses-estimates.html,"Mindtree Q4 profit plunges 27%, misses estimates","Thu, Apr 20 2017. 04 52 PM","Mindtree’s  lower-than-expected profit came in at Rs97.2 crore for the fourth quarter ended 31 March, marking the fourth consecutive quarterly profit decline"
http://www.livemint.com/Industry/0eXiDa4cu92HpPI4bxDenJ/Finance-ministry-in-talks-with-PSBs-to-get-a-fix-on-growth-p.html,"Finance ministry in talks with PSBs to get a fix on growth plans, funding","Sun, Apr 23 2017. 12 38 PM",The finance ministry has initiated detailed discussions with select public sector banks to assess their growth blueprint over the next three years 
http://www.livemint.com/Money/A5zgbPsz1o1gNj5Cv1QoyL/HDFC-Bank-defies-a-challenging-environment.html,HDFC Bank defies a challenging environment,"Sat, Apr 22 2017. 12 18 AM","HDFC Bank reported a net profit of Rs3,990.1 crore for March quarter, an 18.3% increase from the previous year, against a tepid 15% rise in the December quarter"
http://www.livemint.com/Industry/Q20gy9h6tzZ74RjldRbtqK/HDFC-Bank-headcount-falls-for-2nd-quarter-down-by-6100-in.html,"HDFC Bank headcount falls for 2nd quarter, down by 6,100 in Q4","Fri, Apr 21 2017. 09 35 PM","HDFC Bank’s staff strength came down from 90,421 to 84,325 owing to increased digitalisation in the March quarter and it expects the trend to continue"
http://www.livemint.com/Companies/OeQN4QZK0cvMqa4N8bis8N/HDFC-Bank-Q4-profit-rises-18-to-Rs3990-crore-bad-loans-st.html,"HDFC Bank profit rises 18.25% in Q4, beats estimates","Fri, Apr 21 2017. 01 42 PM","HDFC Bank’s net profit rose to Rs3,990.09 crore in the fourth quarter from Rs3,374.22 crore reported a year ago"
http://www.livemint.com/Industry/m9S8uI8tDR1bh3nZ2DLUQI/What-the-IMF-global-financial-stability-report-says-about-In.html,What the IMF global financial stability report says about India,"Fri, Apr 21 2017. 05 01 AM",IMF’s Global Financial Stability Report says India will be among the countries that will see the greatest deterioration in corporate balance sheets
http://www.livemint.com/Industry/Ymo3EawZpeIMPFNZe3XexM/One-MPC-member-mulled-a-repo-rate-hike-say-minutes.html,"One MPC member mulled a repo rate hike, say RBI’s monetary policy minutes","Fri, Apr 21 2017. 01 53 AM",RBI executive director Michael Patra eventually decided to vote in favour of holding repo rate at 6.25% at the monetary policy committee’s 6 April meeting
http://www.livemint.com/Industry/qkKtoHUvBxOSkk9daQ8A5O/Fintech-friction-takes-root-in-Indias-banking-landscape.html,Fintech friction takes root in India’s banking landscape,"Fri, Apr 14 2017. 12 32 AM","As the government resolutely pushes digital payments in a bid to move India towards a less-cash economy, a look at why tension is brewing between fintech firms and large banks"
http://www.livemint.com/Companies/6q3fK2dlQBrxgFzDdcuIGN/Vijay-Mallya-The-story-so-far.html,Vijay Mallya: The story so far,"Wed, Apr 19 2017. 04 25 AM","A look at events that led to Vijay Mallya’s arrest, and bail, in London on Tuesday"
http://www.livemint.com/Companies/smvfjlMWKkl5aX6RZo9MiK/The-cases-against-Vijay-Mallya-and-Kingfisher-Airlines.html,The case(s) against Vijay Mallya and Kingfisher Airlines,"Wed, Apr 19 2017. 04 21 AM",Vijay Mallya and the now defunct Kingfisher Airlines are embroiled in several court cases ranging from money laundering to tax evasion to loan defaults
http://www.livemint.com/Companies/M4SonfozH3m2Rh9EYoZZ0O/Whats-next-in-the-Vijay-Mallya-extradition-process.html,What’s next in the Vijay Mallya extradition process?,"Wed, Apr 19 2017. 02 33 AM",Four of the seven steps in the India UK extradition policy have been completed for Vijay Mallya’s extradition
http://www.livemint.com/Politics/AnKXuKrvorRcHvVVK2IvCP/Full-text-of-the-resolution-of-RBIs-monetary-policy-stateme.html,Full text of RBI’s monetary policy statement,"Thu, Apr 06 2017. 04 38 PM",Here is the full text of  the first bi-monthly monetary policy statement of RBI’s Monetary Policy Committee
http://www.livemint.com/Industry/2I3YejkaglOGVSx8FO1HFL/NEFT-transfer-to-get-quicker-as-RBI-cuts-clearance-time.html,NEFT transfers to be faster as RBI cuts clearance time,"Thu, Apr 06 2017. 07 33 PM",The RBI cuts clearance time for NEFT in an attempt to enhance efficiency of the electronic payment system and add to customer convenience
http://www.livemint.com/Industry/M5QxtXjV9Mi5i7qbdgeZnM/China-tipped-to-boost-liquidity-again-as-bank-tax-payments-l.html,China tipped to boost liquidity again as bank tax payments loom,"Thu, Apr 06 2017. 02 58 PM",China’s central bank is expected to resume cash injections to the financial system this month as tax demands on commercial lenders spur another round of tight liquidity
http://www.livemint.com/Industry/2mYJOZs9skIL0rbEQ41kDM/RBI-monetary-policy-Five-things-to-watch-out-for.html,RBI monetary policy: Five things to watch out for,"Thu, Apr 06 2017. 09 49 AM",RBI’s monetary policy will be a signal of the way the central bank views macroeconomic parameters and the pace at which it expects GDP growth to come back
http://www.livemint.com/Industry/BVALlwTePlO5wDNGxZJsNM/RBI-monetary-policy-guide-Cash-tools-in-focus-as-rates-unch.html,RBI monetary policy guide: Cash tools in focus as rates unchanged,"Thu, Apr 06 2017. 08 22 AM","RBI will keep the repurchase rate at 6.25% on Thursday, according to all 52 economists in a ‘Bloomberg’ survey; 42 of 44 see the cash reserve ratio held at 4%"
http://www.livemint.com/Industry/fqFor88rMGTeTSwuRzj6LJ/UK-exchequer-chancellor-Hammond-urges-strong-ties-with-India.html,UK exchequer chancellor Hammond urges strong ties with India in fintech,"Thu, Apr 06 2017. 01 04 AM",Philip Hammond says UK and India can become strong partners in the financial technology industry as it is keen to make its market truly global after its exit from EU
http://www.livemint.com/Industry/EbvtURh7jAsXp8mMNJFqyK/Ban-on-cash-transaction-above-Rs2-lakh-not-applicable-for-ba.html,"Ban on cash transaction above Rs2 lakh not applicable for bank, post office withdrawals","Wed, Apr 05 2017. 11 41 PM",Income tax department said ban on cash transaction in excess of Rs2 lakh will not be applicable to withdrawals from banks and post office savings accounts
http://www.livemint.com/Companies/z76BaZOutr1CJRAgWcldDM/Tata-Chemicals-Q3-net-profit-rises-32-to-Rs318-crore.html,Tata Chemicals Q3 net profit rises 32% to Rs318 crore,"Wed, Feb 08 2017. 03 50 PM","Tata Chemicals’ income from operations fell to Rs3,494.8 crore in the third quarter from Rs3,991.25 crore in the corresponding period of previous year"
http://www.livemint.com/Companies/rCNhnBpsyXVMg1QgW0nMQI/United-Breweries-asks-Vijay-Mallya-to-step-down-as-nonexecu.html,United Breweries asks Vijay Mallya to step down as non-executive chairman,"Wed, Feb 08 2017. 11 24 PM",United Breweries’s move comes after a Sebi order barred Vijay Mallya from holding directorship in any listed company
http://www.livemint.com/Companies/rEKfRgYSNdGqqLaUZosPLO/Reliance-Power-profit-rises-144-to-Rs27570-crore.html,Reliance Power profit rises 14.4% to Rs275.70 crore,"Wed, Feb 08 2017. 08 00 PM","Reliance Power’s net sales rose 14.2% to Rs2,456.31 crore in the December quarter from Rs2,150.49 crore a year earlier"
http://www.livemint.com/Companies/He8tPPmOrbnpZob4PvKp3H/Union-Bank-of-India-Q3-profit-rises-32-to-Rs104-crore.html,Union Bank of India Q3 profit rises 32% to Rs104 crore,"Wed, Feb 08 2017. 07 34 PM","Union Bank of India’s net interest income rose 7.01% to Rs2,136.62 crore in the December quarter from Rs1,996.51 crore last year"
http://www.livemint.com/Companies/5otSvrxTbibBD7X1KF1RyH/Cipla-Q3-net-profit-jumps-4385-to-Rs37483-crore.html,Cipla Q3 net profit jumps 43.85% to Rs374.83 crore,"Wed, Feb 08 2017. 06 35 PM","Cipla’s net sales during the third quarter under review stood at Rs3,550.02 crore, up 15.63% from the corresponding period last fiscal"
http://www.livemint.com/Companies/3vrDzurulrg5BrAB5SbxjM/NTPC-Q3-net-profit-falls-75-to-Rs2469-crore.html,"NTPC Q3 net profit falls 7.5% to Rs2,469 crore","Wed, Feb 08 2017. 05 31 PM","NTPC’s total income in third quarter rose 11% to Rs19,396 crore on improved gross power generation and higher capacity utilisation of plants"
http://www.livemint.com/Companies/BNXGbtW1l5h9QbjRkkXSjL/Coffee-Day-Enterprises-Q3-net-profit-jumps-146-to-Rs1234-c.html,Coffee Day Enterprises Q3 net profit jumps 146% to Rs12.34 crore,"Wed, Feb 08 2017. 04 59 PM","Sales from Coffee Day Enterprises’s coffee and related businesses segment rose 12.54% to Rs415.33 crore in December quarter, revenue rose 13% to Rs763.32 crore "
http://www.livemint.com/Companies/cSfu7o26XfmspGNzuwIAQL/EBay-Q2-profit-forecast-falls-short-of-estimates.html,EBay Q2 profit forecast falls short of estimates,"Thu, Apr 20 2017. 11 15 AM","EBay’s Q2 profit forecast fell short of analysts’ estimates, as it spends heavily on revamping and marketing its e-commerce platform amid stiff competition from Amazon"
http://www.livemint.com/Industry/8qfOoukBgwpgeNK7p2YMgN/New-RBI-rules-on-provisioning-bad-loans-seen-taking-a-toll.html,"New RBI rules on provisioning, bad loans seen taking a toll on banks","Thu, Apr 20 2017. 03 21 AM",Credit Suisse report says PSU banks are likely to see a 5-15% and private banks 1-2% impact on quarterly results due to new RBI rules on bad loans and provisions
http://www.livemint.com/Companies/OiCdEqSEBdIQU9rLsEzrkI/Network18s-net-loss-widens-to-Rs333-crore-in-March-quarter.html,Network18’s net loss widens to Rs33.3 crore in March quarter,"Wed, Apr 19 2017. 09 08 PM","For the full year to 31 March, Network18 swung to a loss of Rs233.5 crore from a profit of Rs25.4 crore in the previous year"
http://www.livemint.com/Industry/hAEUnVMkkYlg93knIdPrFO/The-issue-is-that-digital-needs-to-get-into-banks-DBS-Bank.html,The issue is that digital needs to get into banks: DBS Bank’s Neal Cross,"Fri, Apr 21 2017. 12 14 AM","DBS Bank MD and chief innovation officer Neal Cross talks about the bank’s digital initiatives, telcos’ move into banking and the impact of artificial intelligence on banking"
http://www.livemint.com/Politics/w9dYOrpluXo29iyzbUZXEJ/Full-text-of-RBIs-monetary-policy-statement.html,Full text of RBI’s monetary policy minutes,"Thu, Apr 20 2017. 07 05 PM",Here is the full text of  the RBI’s Monetary Policy Committee’s minutes
http://www.livemint.com/Industry/eiwotgdAxZt98pGOgmJLCO/Mastercard-unveils-biometric-card-to-replace-ATM-pin-with-fi.html,Mastercard unveils biometric card to replace ATM pin with fingerprint verification,"Thu, Apr 20 2017. 06 48 PM",Mastercard’s new biometric card combines chip technology with fingerprints to conveniently and safely verify cardholder identity for in-store purchases
http://www.livemint.com/Industry/sqLY7qemti9W9fo6VHvBAL/Waiting-for-green-cards-Indian-H1B-visa-holders-see-hope-in.html,"Waiting for green cards, Indian H1B visa holders see hope in Donald Trump review","Sat, Apr 22 2017. 10 00 AM","Many of the Indian immigrants waiting for green cards over a decade, welcome Trump’s  H1B  visa review order as merit-based work visas may increase their chance of green cards"
http://www.livemint.com/Industry/KNtUNVtc3dQGalhizYS7xO/Indian-techies-IT-firms-fret-as-Donald-Trump-orders-US-visa.html,"Indian techies, IT firms fret as Donald Trump orders US visa review","Fri, Apr 21 2017. 10 19 PM","The concerns are particularly acute in India, where IT firms like Tata Consultancy Services, Infosys and Wipro are top beneficiaries of the H1B visa programme"
http://www.livemint.com/Politics/4ItpsVUuXrtimX2wLZXlnL/H1B-visa-curbs-India-threatens-US-with-trade-retaliation.html,"H-1B visa curbs: India talks tough, signals it may hit back at US ","Thu, Apr 20 2017. 08 53 PM",India signals it might take a tougher line in response to H-1B visa curbs put in place by the Donald Trump administration
http://www.livemint.com/Industry/Z46Ubc5E6c4lNZj2SGVw9M/How-to-start-an-analytics-journey.html,How to start an analytics journey,"Fri, Apr 21 2017. 12 07 AM","When it comes to analytics, the two operating words are data and decisions"
http://www.livemint.com/Industry/ATONaFop3NvfvEKNXY5Q8L/Elon-Musk-plans-to-link-human-brains-with-computers-in-4-yea.html,Elon Musk plans to link human brains with computers in 4 years: report,"Fri, Apr 21 2017. 10 36 AM",Elon Musk says his latest company Neuralink is working to link the human brain with a machine interface by creating micron-sized devices
http://www.livemint.com/Industry/o1XkNF6icfWF792xrQgnAL/How-important-is-the-Indian-market-for-the-likes-of-Snapchat.html,How important is the Indian market for the likes of Snapchat?,"Thu, Apr 20 2017. 09 20 AM",Judging India’s market potential by headline poverty or per capita income numbers can be a costly mistake
http://www.livemint.com/Companies/ciRHdYkTsS5xZmjd0fkV2J/Toshiba-said-to-put-chip-sale-process-on-hold-for-now.html,Toshiba said to put chip sale process on hold for now,"Tue, Apr 18 2017. 07 25 PM","Toshiba is trying to sell the business to raise much-needed cash, and the company has been narrowing down the field of interested buyers"
http://www.livemint.com/Companies/GKOA2xer3PawhCAAQjlQCP/TCS-unperturbed-by-possible-changes-to-H1B-visa-regime-CEO.html,TCS unperturbed by possible changes to H1B visa regime: CEO Rajesh Gopinathan,"Tue, Apr 18 2017. 06 08 PM","The current discourse on the H1B visa issue in the US is driven by emotions rather than economy and the best way to tackle it is through greater engagement, says Gopinathan"
http://www.livemint.com/Industry/og1b12vxnCsK6D3nzOQazM/LG-plans-to-make-India-export-hub-amid-Korea-Chian-tensions.html,"LG plans to make India export hub amid Korea, China tensions","Tue, Apr 18 2017. 05 15 PM",LG Electronics India MD Ki Wan Kim says one of the main reasons for the company to explore making India an export hub is due to tension prevailing between South Korea and China
http://www.livemint.com/Industry/QcVZjVHKCoM6AHQWv7s1sI/Future-Retail-gains-steam-as-Kishore-Biyani-rides-demonetisa.html,Future Retail gains as Kishore Biyani rides demonetisation,"Tue, Apr 18 2017. 09 17 AM","Future Retail shares are set to rally 22% in the next 12 months. The stock has surged 128% since 1 January, beating returns from rivals "
http://www.livemint.com/Companies/8qLGdoa8ODkMujUTVjMucL/Dentsu-Aegis-acquires-SVG-Media-in-allcash-deal.html,Dentsu Aegis acquires SVG Media in all-cash deal,"Tue, Apr 18 2017. 12 11 PM","Dentsu Aegis Network, a global digital marketing firm, acquires Indian marketing services group SVG Media in an all-cash deal"
http://www.livemint.com/Companies/Iva79joZDaKMTOJ6zCB0sI/Capacite-Infraprojects-files-for-Rs400-crore-IPO.html,Capacit’e Infraprojects files for Rs400 crore IPO,"Tue, Apr 18 2017. 12 04 AM","Capacit’e Infraprojects to use IPO proceeds for working capital requirements, purchase of capital assets and general corporate purposes"
http://www.livemint.com/Companies/q61AMBbR0keNHmbipTAecI/Supreme-Courts-liquor-ban-hits-FB-exit-plans-for-PE-invest.html,Supreme Court’s liquor ban hits F&B exit plans for PE investors,"Mon, Apr 17 2017. 11 59 PM",Supreme Court’s ban on liquor sales within 500m of highways has hit PE investors who have failed to sell their food and beverages investments in the past couple of years
http://www.livemint.com/Industry/TkRog6FedADLC1OysJgqrK/SBI-unveils-new-branding-after-merger-of-6-entities.html,SBI unveils new branding after merger of 6 entities,"Wed, Apr 05 2017. 10 25 PM","While the legendary SBI monogram has been the de-facto symbol of SBI, combining it with the abbreviated SBI word mark is pivotal to the new identity"
http://www.livemint.com/Industry/IbqZxSMbvhbOg5oAH3VnzJ/RBI-clears-proposal-to-introduce-Rs-200-notes.html,RBI clears proposal to introduce Rs 200 notes,"Mon, Apr 03 2017. 09 57 PM","RBI is likely to start the process of printing the new Rs 200 notes after June, only after the government officially approves this new denomination, says an official "
http://www.livemint.com/Industry/RhQwYI6eqw1aSX5OmOfRVL/Monetary-Policy-Committee-meet-begins-RBI-likely-to-hold-po.html,"Monetary Policy Committee meet begins, RBI likely to hold policy rate","Wed, Apr 05 2017. 08 52 PM",Monetary Policy Committee begins its 2-day meeting amid experts saying that RBI is likely to hold rate while unveiling the first bi-monthly review of 2017-18 in view of hardening inflation
http://www.livemint.com/Industry/KigfBcKaePegnnHltj9L9N/India-formally-launches-BSIV-fuel-to-make-environmental-sta.html,India formally launches BS-IV fuel to make environmental statement,"Sat, Apr 01 2017. 09 29 PM",The launch of BS-IV fuel comes days after the Supreme Court banned sale and registration of BS-III vehicles from 1 April
http://www.livemint.com/Industry/2uBAk0LO33dPnaw22PNQdK/Shell-plans-to-double-Hazira-LNG-plant-capacity-India-head.html,Shell plans to double Hazira LNG plant capacity:  India head,"Sat, Apr 01 2017. 11 15 AM",Shell’s India head Nitin Prasad says the firm plans to double the capacity of its liquefied natural gas import facility at Hazira to 10 million tonnes a year
http://www.livemint.com/Industry/ucEHbXZEcOu8DyrhSgPhxL/SBI-gets-Rs1400-cr-loan-from-European-Investment-Bank-to-fu.html,"SBI gets Rs1,400 cr loan from European Investment Bank to fund solar projects","Sat, Apr 01 2017. 10 31 AM","The SBI gets Rs1,400 crore long-term loan from European Investment Bank to fund five different  solar projects in Tamil Nadu and Telangana"
http://www.livemint.com/Politics/eGRfKJG6KuNYy2ayVplDlN/Govt-gives-25-mega-power-producers-extra-time-for-tax-breaks.html,Govt gives 25 mega power producers extra time for tax breaks,"Sat, Apr 01 2017. 12 59 AM","Extension of incentives to ink deals would increase power availability and ensure consumers do not have to pay more, says government statement"
http://www.livemint.com/Politics/MJRwwh4kOVvn2ZgEHfYHfP/India-to-cut-Iranian-oil-purchases-in-row-over-gas-field.html,India to cut Iranian oil purchases in row over gas field,"Sat, Apr 01 2017. 01 32 AM","Unhappy with Tehran, India’s oil ministry has asked state refiners to cut imports of Iranian oil gradually, before cutting more if there is no progress on award of Farzad B gas field "
http://www.livemint.com/Politics/YTTSBTdFVYj3aRhkhfkRbL/Petrol-price-cut-by-Rs377-per-litre-from-tonight.html,"Petrol price cut by Rs3.77 per litre, diesel price by Rs 2.91, as rupee strengthens ","Fri, Mar 31 2017. 10 52 PM","State-owned oil retailers  have cut petrol and diesel price, passing on to consumers benefits of softening global oil prices and of the strengthening rupee against the dollar "
http://www.livemint.com/Companies/NQafQgez3xjwFlDuOe1ExH/Tata-Steel-swings-to-profit-in-third-quarter.html,Tata Steel registers first profit in 5 quarters,"Tue, Feb 07 2017. 06 44 PM","Tata Steel’s net profit was Rs230 crore in the December quarter from a loss of Rs2,750 crore in the  corresponding period of last year"
http://www.livemint.com/Companies/9AaJWroM1c0tOAwHnXL0lK/United-Bank-of-India-posts-net-profit-of-Rs6410-crore-in-Q3.html,United Bank of India posts net profit of Rs64.10 crore in Q3,"Wed, Feb 08 2017. 01 52 AM","United Bank of India’s net interest income, or the core income a bank earns by giving loans, rose 68.45% to Rs608.09 crore in from Rs360.98 crore last year"
http://www.livemint.com/Companies/dyFAHRzYeLAZ527a3mRskJ/Titan-Q3-profit-rises-1308-on-strong-festive-wedding-seas.html,"Titan Q3 profit rises 13.08% on strong festive, wedding season sales","Tue, Feb 07 2017. 05 24 PM","Titan reported a  13.08% rise in net profit to Rs255.75 crore in the December quarter with revenue rising 14.38% to Rs3,925.95 crore during the period"
http://www.livemint.com/Companies/I9zOulsXPb2kcVSzTenbdJ/How-Infosyss-20-billion-revenue-target-by-202021-is-hurti.html,Infosys weighed down by $20 billion revenue target set by Vishal Sikka ,"Tue, Apr 18 2017. 02 34 AM","Vishal Sikka’s ambitious revenue target, which Infosys is struggling to keep pace with, seems to have done more harm than good"
http://www.livemint.com/Industry/KUE7JGODJlGgYdmQ2VX5KM/Making-predictions-with-Big-Data.html,Making predictions with Big Data,"Fri, Apr 21 2017. 01 12 AM","Technology is playing a ubiquitous role in our daily lives—whether it’s policing a city, speeding up financial transactions or transforming supply chains"
http://www.livemint.com/Industry/8SLYfe8DQr8qLUNAYsn58L/Nasscom-hopes-to-overcome-US-Australia-visa-curbs.html,"Nasscom hopes to overcome US, Australia visa curbs","Thu, Apr 20 2017. 11 20 PM","Nasscom president R. Chandrashekhar says US, Australia visa curbs are operational concerns for Indian IT companies and the industry will soon overcome them"
http://www.livemint.com/Industry/OWeeqJSiHwcDFrOH9kJQoN/Govt-IT-data-on-cloud-system-must-be-stored-within-India-Me.html,Govt IT data on cloud system must be stored within India: Meity,"Thu, Apr 20 2017. 11 13 PM","Meity has empanelled 11 companies for providing cloud computing services to government departments which include Microsoft , IBM India  and  BSNL"
http://www.livemint.com/Industry/mIxk76Xm7lzsbLaOjeIdoK/Oil-companies-to-set-up-more-plants-in-Jammu-and-Kashmir.html,Oil companies to set up more plants in Jammu and Kashmir,"Sat, Apr 22 2017. 08 23 PM",Dharmendra Pradhan informs CM Mehbooba Mufti that oil and gas companies under the oil ministry will recruit from engineering colleges in Jammu and Kashmir
http://www.livemint.com/Industry/0IM4UPDSJz5GDqnvt4bDcI/Merger-of-oil-PSUs-will-hurt-consumers-harm-Indias-energy.html,"Merger of oil PSUs will hurt consumers, harm India’s energy security","Fri, Apr 21 2017. 10 04 AM","A single energy behemoth, created after the merger of oil PSUs, would have too much power over India’s energy strategy, says report"
http://www.livemint.com/Politics/kLTmAS9MdEP7isqPsAp7IN/Oil-marketing-firms-working-to-boost-digital-payments-Dharm.html,Oil marketing firms working to boost digital payments: Dharmendra Pradhan,"Fri, Apr 21 2017. 11 48 PM","Oil minister says a three-pronged strategy has been adopted—rapid expansion of digital payment infrastructure, spreading awareness, and incentivizing consumers "
http://www.livemint.com/Industry/YZFuGcfjSrgSn8lWlnKiiM/Homedelivered-petroleum-may-be-reality-soon.html,Petroleum products may be delivered home soon: Oil ministry,"Fri, Apr 21 2017. 06 02 PM","Oil ministry considering plan for home delivery of petroleum products, based on pre-booking, to cut long queues at fuel stations"
http://www.livemint.com/Industry/o5rTmASGpUmWY8QUVL9juI/Northern-India-can-be-a-hub-of-renewable-energy-says-study.html,"Northern India can be a hub of renewable energy, says study","Fri, Apr 21 2017. 07 55 PM","The study by CII stressed that the ecosystem of renewable energy is still fraught with constraints, particularly with respect to state policies"
http://www.livemint.com/Industry/6TCfli3eJLUVH2dFnxuWEN/Tata-Power-inks-pact-for-electricity-distribution-in-Ajmer.html,Tata Power inks pact for electricity distribution in Ajmer,"Fri, Apr 21 2017. 02 09 PM",Tata Power said it has signed a pact with Ajmer Vidyut Vitran Nigam  for electricity distribution in Ajmer for 20 years
http://www.livemint.com/Industry/iixnKtMIN7WojPH84yPpuO/Modi-govt-plans-to-auction-4-gigawatts-of-wind-energy-in-FY.html,Modi govt plans to auction 4 gigawatts of wind energy in FY 2017-18,"Fri, Apr 21 2017. 10 19 AM",Modi government plans to auction 4 gigawatts of wind capacity in fiscal year 2017-2018 in addition to 750 megawatts of solar capacity it will tender next month
